{
  "schema_version": "1",
  "message_id": "550e8400-e29b-41d4-a716-446655440005",
  "correlation_id": "7b1f4c2e-3a8d-4e9f-b1c2-d3e4f5a6b7c8",
  "causation_id": "550e8400-e29b-41d4-a716-446655440003",
  "source_service": "ledger-service",
  "occurred_at": "2026-04-05T14:32:03.000Z",
  "event_type": "ledger.entry_posted",
  "payload": {
    "entry_id": "c3d4e5f6-a7b8-9c0d-e1f2-a3b4c5d6e7f8",
    "payment_id": "a1b2c3d4-e5f6-7890-abcd-ef1234567890",
    "merchant_id": "f1e2d3c4-b5a6-9870-fedc-ba9876543210",
    "posting_type": "capture",
    "lines": [
      {
        "account": "receivable.merchant.f1e2d3c4-b5a6-9870-fedc-ba9876543210",
        "direction": "debit",
        "amount": {
          "value": 9999,
          "currency": "USD"
        }
      },
      {
        "account": "liability.payable.stripe",
        "direction": "credit",
        "amount": {
          "value": 9999,
          "currency": "USD"
        }
      }
    ],
    "idempotency_key": "a1b2c3d4-e5f6-7890-abcd-ef1234567890:capture",
    "posted_at": "2026-04-05T14:32:03.000Z"
  }
}